<?xml version="1.0" encoding="UTF-8"?>
<!DOCTYPE list SYSTEM "item.dtd">

<list>
  <etcitem id="8400" name="Spellbook: Turn Undead">
    <set name="class" value="SPELLBOOKS"/>
    <set name="crystal_type" value="NONE"/>
    <set name="icon" value="icon.etc_spell_books_assistance_i00"/>
    <set name="price" value="6250"/>
    <set name="stackable" value="true"/>
    <set name="type" value="SPELLBOOK"/>
    <set name="weight" value="120"/>
  </etcitem>
  <etcitem id="8401" name="Spellbook: Major Heal">
    <set name="class" value="SPELLBOOKS"/>
    <set name="crystal_type" value="NONE"/>
    <set name="icon" value="icon.etc_spell_books_assistance_i00"/>
    <set name="price" value="6250"/>
    <set name="stackable" value="true"/>
    <set name="type" value="SPELLBOOK"/>
    <set name="weight" value="120"/>
  </etcitem>
  <etcitem id="8402" name="Spellbook: Major Group Heal">
    <set name="class" value="SPELLBOOKS"/>
    <set name="crystal_type" value="NONE"/>
    <set name="icon" value="icon.etc_spell_books_assistance_i00"/>
    <set name="price" value="6750"/>
    <set name="stackable" value="true"/>
    <set name="type" value="SPELLBOOK"/>
    <set name="weight" value="120"/>
  </etcitem>
  <etcitem id="8403" name="Small Nimble Green Fish - Upper Grade">
    <set name="class" value="OTHER"/>
    <set name="crystal_type" value="NONE"/>
    <set name="icon" value="icon.etc_tuna_i07"/>
    <set name="price" value="138"/>
    <set name="stackable" value="true"/>
    <set name="type" value="OTHER"/>
    <set name="weight" value="100"/>
  </etcitem>
  <etcitem id="8404" name="Small Ugly Green Fish - Upper Grade">
    <set name="class" value="OTHER"/>
    <set name="crystal_type" value="NONE"/>
    <set name="icon" value="icon.etc_angler_i07"/>
    <set name="price" value="141"/>
    <set name="stackable" value="true"/>
    <set name="type" value="OTHER"/>
    <set name="weight" value="100"/>
  </etcitem>
  <etcitem id="8405" name="Small Pudgy Green Fish - Upper Grade">
    <set name="class" value="OTHER"/>
    <set name="crystal_type" value="NONE"/>
    <set name="icon" value="icon.etc_bream_i07"/>
    <set name="price" value="153"/>
    <set name="stackable" value="true"/>
    <set name="type" value="OTHER"/>
    <set name="weight" value="100"/>
  </etcitem>
  <etcitem id="8406" name="Nimble Green Fish - Upper Grade">
    <set name="class" value="OTHER"/>
    <set name="crystal_type" value="NONE"/>
    <set name="icon" value="icon.etc_tuna_i07"/>
    <set name="price" value="167"/>
    <set name="stackable" value="true"/>
    <set name="type" value="OTHER"/>
    <set name="weight" value="100"/>
  </etcitem>
  <etcitem id="8407" name="Ugly Green Fish - Upper Grade">
    <set name="class" value="OTHER"/>
    <set name="crystal_type" value="NONE"/>
    <set name="icon" value="icon.etc_angler_i07"/>
    <set name="price" value="187"/>
    <set name="stackable" value="true"/>
    <set name="type" value="OTHER"/>
    <set name="weight" value="100"/>
  </etcitem>
  <etcitem id="8408" name="Pudgy Green Fish - Upper Grade">
    <set name="class" value="OTHER"/>
    <set name="crystal_type" value="NONE"/>
    <set name="icon" value="icon.etc_bream_i07"/>
    <set name="price" value="208"/>
    <set name="stackable" value="true"/>
    <set name="type" value="OTHER"/>
    <set name="weight" value="100"/>
  </etcitem>
  <etcitem id="8409" name="Large Nimble Green Fish - Upper Grade">
    <set name="class" value="OTHER"/>
    <set name="crystal_type" value="NONE"/>
    <set name="icon" value="icon.etc_tuna_i07"/>
    <set name="price" value="225"/>
    <set name="stackable" value="true"/>
    <set name="type" value="OTHER"/>
    <set name="weight" value="100"/>
  </etcitem>
  <etcitem id="8410" name="Large Ugly Green Fish - Upper Grade">
    <set name="class" value="OTHER"/>
    <set name="crystal_type" value="NONE"/>
    <set name="icon" value="icon.etc_angler_i07"/>
    <set name="price" value="248"/>
    <set name="stackable" value="true"/>
    <set name="type" value="OTHER"/>
    <set name="weight" value="100"/>
  </etcitem>
  <etcitem id="8411" name="Large Pudgy Green Fish - Upper Grade">
    <set name="class" value="OTHER"/>
    <set name="crystal_type" value="NONE"/>
    <set name="icon" value="icon.etc_bream_i07"/>
    <set name="price" value="265"/>
    <set name="stackable" value="true"/>
    <set name="type" value="OTHER"/>
    <set name="weight" value="100"/>
  </etcitem>
  <etcitem id="8412" name="Small Jade Nimble Fish - Upper Grade">
    <set name="class" value="OTHER"/>
    <set name="crystal_type" value="NONE"/>
    <set name="icon" value="icon.etc_tuna_i06"/>
    <set name="price" value="285"/>
    <set name="stackable" value="true"/>
    <set name="type" value="OTHER"/>
    <set name="weight" value="100"/>
  </etcitem>
  <etcitem id="8413" name="Small Jade Ugly Fish - Upper Grade">
    <set name="class" value="OTHER"/>
    <set name="crystal_type" value="NONE"/>
    <set name="icon" value="icon.etc_angler_i06"/>
    <set name="price" value="295"/>
    <set name="stackable" value="true"/>
    <set name="type" value="OTHER"/>
    <set name="weight" value="100"/>
  </etcitem>
  <etcitem id="8414" name="Small Jade Fat Fish - Upper Grade">
    <set name="class" value="OTHER"/>
    <set name="crystal_type" value="NONE"/>
    <set name="icon" value="icon.etc_bream_i06"/>
    <set name="price" value="310"/>
    <set name="stackable" value="true"/>
    <set name="type" value="OTHER"/>
    <set name="weight" value="100"/>
  </etcitem>
  <etcitem id="8415" name="Jade Nimble Fish - Upper Grade">
    <set name="class" value="OTHER"/>
    <set name="crystal_type" value="NONE"/>
    <set name="icon" value="icon.etc_tuna_i06"/>
    <set name="price" value="325"/>
    <set name="stackable" value="true"/>
    <set name="type" value="OTHER"/>
    <set name="weight" value="100"/>
  </etcitem>
  <etcitem id="8416" name="Jade Ugly Fish - Upper Grade">
    <set name="class" value="OTHER"/>
    <set name="crystal_type" value="NONE"/>
    <set name="icon" value="icon.etc_angler_i06"/>
    <set name="price" value="340"/>
    <set name="stackable" value="true"/>
    <set name="type" value="OTHER"/>
    <set name="weight" value="100"/>
  </etcitem>
  <etcitem id="8417" name="Jade Fat Fish - Upper Grade">
    <set name="class" value="OTHER"/>
    <set name="crystal_type" value="NONE"/>
    <set name="icon" value="icon.etc_bream_i06"/>
    <set name="price" value="355"/>
    <set name="stackable" value="true"/>
    <set name="type" value="OTHER"/>
    <set name="weight" value="100"/>
  </etcitem>
  <etcitem id="8418" name="Large Jade Nimble Fish - Upper Grade">
    <set name="class" value="OTHER"/>
    <set name="crystal_type" value="NONE"/>
    <set name="icon" value="icon.etc_tuna_i06"/>
    <set name="price" value="365"/>
    <set name="stackable" value="true"/>
    <set name="type" value="OTHER"/>
    <set name="weight" value="100"/>
  </etcitem>
  <etcitem id="8419" name="Large Jade Ugly Fish - Upper Grade">
    <set name="class" value="OTHER"/>
    <set name="crystal_type" value="NONE"/>
    <set name="icon" value="icon.etc_angler_i06"/>
    <set name="price" value="375"/>
    <set name="stackable" value="true"/>
    <set name="type" value="OTHER"/>
    <set name="weight" value="100"/>
  </etcitem>
  <etcitem id="8420" name="Large Jade Fat Fish - Upper Grade">
    <set name="class" value="OTHER"/>
    <set name="crystal_type" value="NONE"/>
    <set name="icon" value="icon.etc_bream_i06"/>
    <set name="price" value="385"/>
    <set name="stackable" value="true"/>
    <set name="type" value="OTHER"/>
    <set name="weight" value="100"/>
  </etcitem>
  <etcitem id="8421" name="Small Blue Nimble Fish - Upper Grade">
    <set name="class" value="OTHER"/>
    <set name="crystal_type" value="NONE"/>
    <set name="icon" value="icon.etc_tuna_i01"/>
    <set name="price" value="395"/>
    <set name="stackable" value="true"/>
    <set name="type" value="OTHER"/>
    <set name="weight" value="100"/>
  </etcitem>
  <etcitem id="8422" name="Small Blue Ugly Fish - Upper Grade">
    <set name="class" value="OTHER"/>
    <set name="crystal_type" value="NONE"/>
    <set name="icon" value="icon.etc_angler_i01"/>
    <set name="price" value="400"/>
    <set name="stackable" value="true"/>
    <set name="type" value="OTHER"/>
    <set name="weight" value="100"/>
  </etcitem>
  <etcitem id="8423" name="Small Blue Fat Fish - Upper Grade">
    <set name="class" value="OTHER"/>
    <set name="crystal_type" value="NONE"/>
    <set name="icon" value="icon.etc_bream_i01"/>
    <set name="price" value="410"/>
    <set name="stackable" value="true"/>
    <set name="type" value="OTHER"/>
    <set name="weight" value="100"/>
  </etcitem>
  <etcitem id="8424" name="Blue Nimble Fish - Upper Grade">
    <set name="class" value="OTHER"/>
    <set name="crystal_type" value="NONE"/>
    <set name="icon" value="icon.etc_tuna_i01"/>
    <set name="price" value="415"/>
    <set name="stackable" value="true"/>
    <set name="type" value="OTHER"/>
    <set name="weight" value="100"/>
  </etcitem>
  <etcitem id="8425" name="Blue Ugly Fish - Upper Grade">
    <set name="class" value="OTHER"/>
    <set name="crystal_type" value="NONE"/>
    <set name="icon" value="icon.etc_angler_i01"/>
    <set name="price" value="418"/>
    <set name="stackable" value="true"/>
    <set name="type" value="OTHER"/>
    <set name="weight" value="100"/>
  </etcitem>
  <etcitem id="8426" name="Blue Fat Fish - Upper Grade">
    <set name="class" value="OTHER"/>
    <set name="crystal_type" value="NONE"/>
    <set name="icon" value="icon.etc_bream_i01"/>
    <set name="price" value="420"/>
    <set name="stackable" value="true"/>
    <set name="type" value="OTHER"/>
    <set name="weight" value="100"/>
  </etcitem>
  <etcitem id="8427" name="Large Blue Nimble Fish - Upper Grade">
    <set name="class" value="OTHER"/>
    <set name="crystal_type" value="NONE"/>